{
  "schema_version": "v0",
  "signed_bundle_id": "signed-9c3b97ca-ea51-4779-a85a-8fa3eb6cee88",
  "science_claim_bundle": {
    "schema_version": "ScienceClaimBundle.v0",
    "bundle_id": "science-claim-bundle-qc-release-001",
    "created_at": "2026-05-16T12:05:00Z",
    "producer": "LabTrust-Gym",
    "producer_version": "0.1.0",
    "source_repo": "https://github.com/fraware/LabTrust-Gym",
    "source_commit": "labtrust-demo-001",
    "status": "RuntimeObserved",
    "signature_or_digest": "sha256:labtrust-bundle-digest-001",
    "claim_artifact": {
      "schema_version": "ClaimArtifact.v0",
      "created_at": "2026-05-16T12:00:00Z",
      "producer": "LabTrust-Gym",
      "producer_version": "0.1.0",
      "source_repo": "https://github.com/fraware/LabTrust-Gym",
      "source_commit": "labtrust-demo-001",
      "status": "RuntimeObserved",
      "signature_or_digest": "sha256:claim-artifact-digest-001",
      "artifact_id": "claim-qc-release-001",
      "claim_id": "claim-qc-release-001",
      "assumption_set_ref": "assumption-set-qc-release-001"
    },
    "assumption_set": {
      "schema_version": "AssumptionSet.v0",
      "created_at": "2026-05-16T12:00:00Z",
      "producer": "LabTrust-Gym",
      "producer_version": "0.1.0",
      "source_repo": "https://github.com/fraware/LabTrust-Gym",
      "source_commit": "labtrust-demo-001",
      "status": "HumanReviewed",
      "signature_or_digest": "sha256:assumption-set-digest-001",
      "artifact_id": "assumption-set-qc-release-001",
      "assumption_set_id": "assumption-set-qc-release-001"
    },
    "runtime_receipt": {
      "schema_version": "RuntimeReceipt.v0",
      "created_at": "2026-05-16T12:01:00Z",
      "producer": "LabTrust-Gym",
      "producer_version": "0.1.0",
      "source_repo": "https://github.com/fraware/LabTrust-Gym",
      "source_commit": "labtrust-demo-001",
      "status": "RuntimeObserved",
      "signature_or_digest": "sha256:runtime-receipt-digest-001",
      "artifact_id": "runtime-receipt-qc-release-001",
      "receipt_id": "runtime-receipt-qc-release-001",
      "trace_hash": "e3b0c44298fc1c149afbf4c8996fb92427ae41e4649b934ca495991b7852b855"
    },
    "trace_certificate": {
      "schema_version": "TraceCertificate.v0",
      "created_at": "2026-05-16T12:02:00Z",
      "producer": "CertifyEdge",
      "producer_version": "0.1.0",
      "source_repo": "https://github.com/fraware/CertifyEdge",
      "source_commit": "certifyedge-demo-001",
      "status": "CertificateChecked",
      "signature_or_digest": "sha256:trace-certificate-digest-001",
      "artifact_id": "trace-cert-qc-release-001",
      "certificate_id": "trace-cert-qc-release-001",
      "trace_hash": "e3b0c44298fc1c149afbf4c8996fb92427ae41e4649b934ca495991b7852b855"
    },
    "evidence_bundle": {
      "schema_version": "EvidenceBundle.v0",
      "created_at": "2026-05-16T12:03:00Z",
      "producer": "LabTrust-Gym",
      "producer_version": "0.1.0",
      "source_repo": "https://github.com/fraware/LabTrust-Gym",
      "source_commit": "labtrust-demo-001",
      "status": "RuntimeObserved",
      "signature_or_digest": "sha256:evidence-bundle-digest-001",
      "artifact_id": "evidence-bundle-qc-release-001",
      "evidence_bundle_id": "evidence-bundle-qc-release-001",
      "artifact_refs": [
        "claim-qc-release-001",
        "assumption-set-qc-release-001",
        "runtime-receipt-qc-release-001",
        "trace-cert-qc-release-001"
      ]
    }
  },
  "verification_result": {
    "schema_version": "v0",
    "verification_id": "verification-f5088bfe-3d90-44be-897b-bcce74e845b1",
    "bundle_id": "science-claim-bundle-qc-release-001",
    "verifier": "Provability Fabric",
    "verifier_version": "0.1.0",
    "status": "passed",
    "checks": [
      {
        "check_id": "science_claim_bundle_schema",
        "description": "ScienceClaimBundle.v0 schema is valid",
        "status": "passed",
        "details": {
          "schema": "config/schemas/pcs/ScienceClaimBundle.v0.schema.json"
        }
      },
      {
        "check_id": "claim_artifact_present",
        "description": "ClaimArtifact.v0 exists",
        "status": "passed",
        "details": {
          "artifact": "claim_artifact",
          "present": true
        }
      },
      {
        "check_id": "assumption_set_present",
        "description": "AssumptionSet.v0 exists",
        "status": "passed",
        "details": {
          "artifact": "assumption_set",
          "present": true
        }
      },
      {
        "check_id": "runtime_receipt_present",
        "description": "RuntimeReceipt.v0 exists",
        "status": "passed",
        "details": {
          "artifact": "runtime_receipt",
          "present": true
        }
      },
      {
        "check_id": "trace_certificate_present",
        "description": "At least one TraceCertificate.v0 exists",
        "status": "passed",
        "details": {
          "artifact": "trace_certificate",
          "present": true
        }
      },
      {
        "check_id": "evidence_bundle_present",
        "description": "EvidenceBundle.v0 exists",
        "status": "passed",
        "details": {
          "artifact": "evidence_bundle",
          "present": true
        }
      },
      {
        "check_id": "assumption_set_ref_match",
        "description": "ClaimArtifact.assumption_set_ref matches AssumptionSet.assumption_set_id",
        "status": "passed",
        "details": {
          "assumption_set_ref": "assumption-set-qc-release-001"
        }
      },
      {
        "check_id": "runtime_trace_hash_present",
        "description": "RuntimeReceipt.trace_hash is non-empty",
        "status": "passed",
        "details": {
          "trace_hash": "e3b0c44298fc1c149afbf4c8996fb92427ae41e4649b934ca495991b7852b855"
        }
      },
      {
        "check_id": "trace_hash_alignment",
        "description": "TraceCertificate.trace_hash matches RuntimeReceipt.trace_hash",
        "status": "passed",
        "details": {
          "certificate_count": 1,
          "trace_hash": "e3b0c44298fc1c149afbf4c8996fb92427ae41e4649b934ca495991b7852b855"
        }
      },
      {
        "check_id": "certificate_status_checked",
        "description": "TraceCertificate.status is CertificateChecked",
        "status": "passed",
        "details": {
          "certificate_count": 1,
          "status": "CertificateChecked"
        }
      },
      {
        "check_id": "evidence_refs_complete",
        "description": "EvidenceBundle references claim, assumption set, receipt, and certificate",
        "status": "passed",
        "details": {
          "artifact_refs": [
            "claim-qc-release-001",
            "assumption-set-qc-release-001",
            "runtime-receipt-qc-release-001",
            "trace-cert-qc-release-001"
          ]
        }
      },
      {
        "check_id": "artifact_not_stale",
        "description": "No required artifact has status Stale",
        "status": "passed",
        "details": {}
      },
      {
        "check_id": "source_provenance_present",
        "description": "source_repo and source_commit are present",
        "status": "passed",
        "details": {}
      },
      {
        "check_id": "signature_or_digest_present",
        "description": "signature_or_digest is present",
        "status": "passed",
        "details": {}
      },
      {
        "check_id": "source_commit_not_placeholder",
        "description": "source_commit is not the 40-zero placeholder unless local_dev = true",
        "status": "passed",
        "details": {}
      }
    ],
    "created_at": "2026-05-17T07:52:03Z",
    "source_repo": "https://github.com/SentinelOps-CI/provability-fabric",
    "source_commit": "9c3b2c258bdc8bc33f7d56620cbdbcb898089a1f",
    "signature_or_digest": "sha256:96daba16a7604e1ca0a54157e7a340bd2a243834c5b04ad218129d832ea8b85f"
  },
  "signer": "Provability Fabric",
  "signed_at": "2026-05-17T07:52:03Z",
  "source_repo": "https://github.com/SentinelOps-CI/provability-fabric",
  "source_commit": "9c3b2c258bdc8bc33f7d56620cbdbcb898089a1f",
  "signature_or_digest": "sha256:4ed447fd468b427179e6c314d8f27c429b742c08d16bee0ab1a998eb92e1f719"
}